{
  "charterSpecVersion": "1.3.0",
  "namespace": "harbor.example",
  "kind": "SodConstraint",
  "id": "SOD-PREPARE-APPROVE-CREDIT",
  "enterpriseId": "ENT-HARBOR",
  "constrainedActions": [
    "CAP-PROPOSE-ORDER-RESOLUTION",
    "CAP-APPROVE-CREDIT-EXCEPTION"
  ],
  "scope": "the same order exception"
}
